{
  "domain": "app-privacy-remediation",
  "sample_id": "sample-notice-001",
  "notice_date": "2026-09-07",
  "term_workdays": 15,
  "apps": [
    { "app_id": "app-001", "name": "示例应用01", "platform": "app", "channel": "android_market", "version": "2.3.0", "problem": "rules_not_published" },
    { "app_id": "app-002", "name": "示例应用02", "platform": "app", "channel": "ios_store", "version": "4.1.0", "problem": "excessive_permission_requests" },
    { "app_id": "app-003", "name": "示例应用03", "platform": "app", "channel": "android_market", "version": "2.0.0", "problem": "incomplete_disclosure" },
    { "app_id": "app-004", "name": "示例应用04", "platform": "app", "channel": "ios_store", "version": "3.5.2", "problem": "account_not_deletable" },
    { "app_id": "app-005", "name": "示例应用05", "platform": "app", "channel": "android_market", "version": "1.8.0", "problem": "rules_not_published" },
    { "app_id": "app-006", "name": "示例应用06", "platform": "app", "channel": "ios_store", "version": "2.2.1", "problem": "excessive_permission_requests" },
    { "app_id": "app-007", "name": "示例应用07", "platform": "app", "channel": "android_market", "version": "5.0.0", "problem": "incomplete_disclosure" },
    { "app_id": "app-008", "name": "示例应用08", "platform": "app", "channel": "ios_store", "version": "1.4.0", "problem": "account_not_deletable" },
    { "app_id": "app-009", "name": "示例应用09", "platform": "app", "channel": "android_market", "version": "3.1.0", "problem": "rules_not_published" },
    { "app_id": "app-010", "name": "示例应用10", "platform": "app", "channel": "ios_store", "version": "2.0.3", "problem": "excessive_permission_requests" },
    { "app_id": "app-011", "name": "示例应用11", "platform": "app", "channel": "android_market", "version": "4.2.0", "problem": "incomplete_disclosure" },
    { "app_id": "app-012", "name": "示例应用12", "platform": "app", "channel": "ios_store", "version": "1.1.0", "problem": "account_not_deletable" },
    { "app_id": "app-013", "name": "示例应用13", "platform": "app", "channel": "android_market", "version": "2.5.0", "problem": "rules_not_published" },
    { "app_id": "app-014", "name": "示例应用14", "platform": "app", "channel": "ios_store", "version": "3.3.0", "problem": "excessive_permission_requests" },
    { "app_id": "app-015", "name": "示例应用15", "platform": "app", "channel": "android_market", "version": "1.6.1", "problem": "incomplete_disclosure" },
    { "app_id": "app-016", "name": "示例应用16", "platform": "app", "channel": "ios_store", "version": "2.8.0", "problem": "account_not_deletable" },
    { "app_id": "app-017", "name": "示例应用17", "platform": "app", "channel": "android_market", "version": "4.0.1", "problem": "rules_not_published" },
    { "app_id": "app-018", "name": "示例应用18", "platform": "app", "channel": "ios_store", "version": "1.2.0", "problem": "excessive_permission_requests" },
    { "app_id": "app-019", "name": "示例应用19", "platform": "app", "channel": "android_market", "version": "3.0.0", "problem": "incomplete_disclosure" },
    { "app_id": "app-020", "name": "示例应用20", "platform": "app", "channel": "ios_store", "version": "2.4.2", "problem": "account_not_deletable" },
    { "app_id": "app-021", "name": "示例应用21", "platform": "app", "channel": "android_market", "version": "5.1.0", "problem": "rules_not_published" },
    { "app_id": "app-022", "name": "示例应用22", "platform": "app", "channel": "ios_store", "version": "2.6.0", "problem": "excessive_permission_requests" },
    { "app_id": "app-023", "name": "示例应用23", "platform": "app", "channel": "android_market", "version": "1.3.0", "problem": "rules_not_published" },
    { "app_id": "app-024", "name": "示例应用24", "platform": "app", "channel": "ios_store", "version": "4.4.0", "problem": "excessive_permission_requests" },
    { "app_id": "app-025", "name": "示例应用25", "platform": "app", "channel": "android_market", "version": "2.1.0", "problem": "rules_not_published" },
    { "app_id": "app-026", "name": "示例小程序26", "platform": "mini_program", "channel": "mini_program", "version": "1.1.0", "problem": "incomplete_disclosure" },
    { "app_id": "app-027", "name": "示例小程序27", "platform": "mini_program", "channel": "mini_program", "version": "1.4.0", "problem": "incomplete_disclosure" },
    { "app_id": "app-028", "name": "示例小程序28", "platform": "mini_program", "channel": "mini_program", "version": "2.0.0", "problem": "excessive_permission_requests" },
    { "app_id": "app-029", "name": "示例小程序29", "platform": "mini_program", "channel": "mini_program", "version": "1.0.3", "problem": "account_not_deletable" },
    { "app_id": "app-030", "name": "示例小程序30", "platform": "mini_program", "channel": "mini_program", "version": "3.2.1", "problem": "rules_not_published" }
  ]
}
